{
  "schema": "motionjson.object_manifest.v0.1",
  "objectId": "object_0",
  "label": "selected_object",
  "renderMode": "raster_alpha_sequence",
  "cutouts": [
    "objects/object_0/cutouts/cutout_000001.png",
    "objects/object_0/cutouts/cutout_000002.png",
    "objects/object_0/cutouts/cutout_000003.png",
    "objects/object_0/cutouts/cutout_000004.png",
    "objects/object_0/cutouts/cutout_000005.png",
    "objects/object_0/cutouts/cutout_000006.png",
    "objects/object_0/cutouts/cutout_000007.png",
    "objects/object_0/cutouts/cutout_000008.png",
    "objects/object_0/cutouts/cutout_000009.png",
    "objects/object_0/cutouts/cutout_000010.png",
    "objects/object_0/cutouts/cutout_000011.png",
    "objects/object_0/cutouts/cutout_000012.png",
    "objects/object_0/cutouts/cutout_000013.png",
    "objects/object_0/cutouts/cutout_000014.png",
    "objects/object_0/cutouts/cutout_000015.png",
    "objects/object_0/cutouts/cutout_000016.png",
    "objects/object_0/cutouts/cutout_000017.png",
    "objects/object_0/cutouts/cutout_000018.png",
    "objects/object_0/cutouts/cutout_000019.png",
    "objects/object_0/cutouts/cutout_000020.png",
    "objects/object_0/cutouts/cutout_000021.png",
    "objects/object_0/cutouts/cutout_000022.png",
    "objects/object_0/cutouts/cutout_000023.png",
    "objects/object_0/cutouts/cutout_000024.png",
    "objects/object_0/cutouts/cutout_000025.png",
    "objects/object_0/cutouts/cutout_000026.png",
    "objects/object_0/cutouts/cutout_000027.png",
    "objects/object_0/cutouts/cutout_000028.png",
    "objects/object_0/cutouts/cutout_000029.png",
    "objects/object_0/cutouts/cutout_000030.png",
    "objects/object_0/cutouts/cutout_000031.png",
    "objects/object_0/cutouts/cutout_000032.png",
    "objects/object_0/cutouts/cutout_000033.png",
    "objects/object_0/cutouts/cutout_000034.png",
    "objects/object_0/cutouts/cutout_000035.png",
    "objects/object_0/cutouts/cutout_000036.png",
    "objects/object_0/cutouts/cutout_000037.png",
    "objects/object_0/cutouts/cutout_000038.png",
    "objects/object_0/cutouts/cutout_000039.png",
    "objects/object_0/cutouts/cutout_000040.png",
    "objects/object_0/cutouts/cutout_000041.png",
    "objects/object_0/cutouts/cutout_000042.png",
    "objects/object_0/cutouts/cutout_000043.png",
    "objects/object_0/cutouts/cutout_000044.png",
    "objects/object_0/cutouts/cutout_000045.png",
    "objects/object_0/cutouts/cutout_000046.png",
    "objects/object_0/cutouts/cutout_000047.png",
    "objects/object_0/cutouts/cutout_000048.png"
  ],
  "masks": [
    "masks/object_0/mask_000001.png",
    "masks/object_0/mask_000002.png",
    "masks/object_0/mask_000003.png",
    "masks/object_0/mask_000004.png",
    "masks/object_0/mask_000005.png",
    "masks/object_0/mask_000006.png",
    "masks/object_0/mask_000007.png",
    "masks/object_0/mask_000008.png",
    "masks/object_0/mask_000009.png",
    "masks/object_0/mask_000010.png",
    "masks/object_0/mask_000011.png",
    "masks/object_0/mask_000012.png",
    "masks/object_0/mask_000013.png",
    "masks/object_0/mask_000014.png",
    "masks/object_0/mask_000015.png",
    "masks/object_0/mask_000016.png",
    "masks/object_0/mask_000017.png",
    "masks/object_0/mask_000018.png",
    "masks/object_0/mask_000019.png",
    "masks/object_0/mask_000020.png",
    "masks/object_0/mask_000021.png",
    "masks/object_0/mask_000022.png",
    "masks/object_0/mask_000023.png",
    "masks/object_0/mask_000024.png",
    "masks/object_0/mask_000025.png",
    "masks/object_0/mask_000026.png",
    "masks/object_0/mask_000027.png",
    "masks/object_0/mask_000028.png",
    "masks/object_0/mask_000029.png",
    "masks/object_0/mask_000030.png",
    "masks/object_0/mask_000031.png",
    "masks/object_0/mask_000032.png",
    "masks/object_0/mask_000033.png",
    "masks/object_0/mask_000034.png",
    "masks/object_0/mask_000035.png",
    "masks/object_0/mask_000036.png",
    "masks/object_0/mask_000037.png",
    "masks/object_0/mask_000038.png",
    "masks/object_0/mask_000039.png",
    "masks/object_0/mask_000040.png",
    "masks/object_0/mask_000041.png",
    "masks/object_0/mask_000042.png",
    "masks/object_0/mask_000043.png",
    "masks/object_0/mask_000044.png",
    "masks/object_0/mask_000045.png",
    "masks/object_0/mask_000046.png",
    "masks/object_0/mask_000047.png",
    "masks/object_0/mask_000048.png"
  ],
  "spritesheet": {
    "path": "objects/object_0/spritesheet.webp",
    "width": 721,
    "height": 721,
    "columns": 7,
    "rows": 7,
    "cellWidth": 103,
    "cellHeight": 103,
    "frames": [
      {
        "x": 0,
        "y": 0,
        "w": 103,
        "h": 103
      },
      {
        "x": 103,
        "y": 0,
        "w": 102,
        "h": 103
      },
      {
        "x": 206,
        "y": 0,
        "w": 102,
        "h": 103
      },
      {
        "x": 309,
        "y": 0,
        "w": 100,
        "h": 102
      },
      {
        "x": 412,
        "y": 0,
        "w": 103,
        "h": 103
      },
      {
        "x": 515,
        "y": 0,
        "w": 102,
        "h": 102
      },
      {
        "x": 618,
        "y": 0,
        "w": 102,
        "h": 100
      },
      {
        "x": 0,
        "y": 103,
        "w": 103,
        "h": 103
      },
      {
        "x": 103,
        "y": 103,
        "w": 102,
        "h": 103
      },
      {
        "x": 206,
        "y": 103,
        "w": 102,
        "h": 103
      },
      {
        "x": 309,
        "y": 103,
        "w": 102,
        "h": 103
      },
      {
        "x": 412,
        "y": 103,
        "w": 102,
        "h": 103
      },
      {
        "x": 515,
        "y": 103,
        "w": 103,
        "h": 103
      },
      {
        "x": 618,
        "y": 103,
        "w": 103,
        "h": 103
      },
      {
        "x": 0,
        "y": 206,
        "w": 102,
        "h": 103
      },
      {
        "x": 103,
        "y": 206,
        "w": 103,
        "h": 103
      },
      {
        "x": 206,
        "y": 206,
        "w": 103,
        "h": 103
      },
      {
        "x": 309,
        "y": 206,
        "w": 103,
        "h": 103
      },
      {
        "x": 412,
        "y": 206,
        "w": 103,
        "h": 103
      },
      {
        "x": 515,
        "y": 206,
        "w": 103,
        "h": 103
      },
      {
        "x": 618,
        "y": 206,
        "w": 103,
        "h": 103
      },
      {
        "x": 0,
        "y": 309,
        "w": 103,
        "h": 103
      },
      {
        "x": 103,
        "y": 309,
        "w": 103,
        "h": 103
      },
      {
        "x": 206,
        "y": 309,
        "w": 103,
        "h": 103
      },
      {
        "x": 309,
        "y": 309,
        "w": 103,
        "h": 103
      },
      {
        "x": 412,
        "y": 309,
        "w": 103,
        "h": 103
      },
      {
        "x": 515,
        "y": 309,
        "w": 103,
        "h": 103
      },
      {
        "x": 618,
        "y": 309,
        "w": 103,
        "h": 101
      },
      {
        "x": 0,
        "y": 412,
        "w": 103,
        "h": 102
      },
      {
        "x": 103,
        "y": 412,
        "w": 103,
        "h": 103
      },
      {
        "x": 206,
        "y": 412,
        "w": 103,
        "h": 103
      },
      {
        "x": 309,
        "y": 412,
        "w": 102,
        "h": 103
      },
      {
        "x": 412,
        "y": 412,
        "w": 103,
        "h": 101
      },
      {
        "x": 515,
        "y": 412,
        "w": 103,
        "h": 103
      },
      {
        "x": 618,
        "y": 412,
        "w": 103,
        "h": 103
      },
      {
        "x": 0,
        "y": 515,
        "w": 103,
        "h": 103
      },
      {
        "x": 103,
        "y": 515,
        "w": 103,
        "h": 103
      },
      {
        "x": 206,
        "y": 515,
        "w": 101,
        "h": 101
      },
      {
        "x": 309,
        "y": 515,
        "w": 103,
        "h": 102
      },
      {
        "x": 412,
        "y": 515,
        "w": 103,
        "h": 103
      },
      {
        "x": 515,
        "y": 515,
        "w": 103,
        "h": 103
      },
      {
        "x": 618,
        "y": 515,
        "w": 103,
        "h": 103
      },
      {
        "x": 0,
        "y": 618,
        "w": 103,
        "h": 103
      },
      {
        "x": 103,
        "y": 618,
        "w": 103,
        "h": 102
      },
      {
        "x": 206,
        "y": 618,
        "w": 103,
        "h": 103
      },
      {
        "x": 309,
        "y": 618,
        "w": 103,
        "h": 103
      },
      {
        "x": 412,
        "y": 618,
        "w": 102,
        "h": 103
      },
      {
        "x": 515,
        "y": 618,
        "w": 103,
        "h": 101
      }
    ]
  },
  "motion": [
    {
      "frame": 1,
      "sourceFrameIndex": 0,
      "t": 0.0,
      "visible": true,
      "x": 29,
      "y": 129,
      "w": 103,
      "h": 103,
      "scale": 1.0,
      "rotation": 0.0,
      "opacity": 1.0,
      "anchor": [
        51.196,
        50.779
      ],
      "asset": "objects/object_0/cutouts/cutout_000001.png",
      "mask": "masks/object_0/mask_000001.png",
      "centroid": [
        80.1964954023843,
        179.77891788732742
      ],
      "sprite": {
        "x": 0,
        "y": 0,
        "w": 103,
        "h": 103
      }
    },
    {
      "frame": 2,
      "sourceFrameIndex": 2,
      "t": 0.083333,
      "visible": true,
      "x": 39,
      "y": 138,
      "w": 102,
      "h": 103,
      "scale": 1.0,
      "rotation": 0.0,
      "opacity": 1.0,
      "anchor": [
        51.021,
        50.9
      ],
      "asset": "objects/object_0/cutouts/cutout_000002.png",
      "mask": "masks/object_0/mask_000002.png",
      "centroid": [
        90.02133652384157,
        188.89954884219446
      ],
      "sprite": {
        "x": 103,
        "y": 0,
        "w": 102,
        "h": 103
      }
    },
    {
      "frame": 3,